id,user_id,description,start_date,end_date,created_by,updated_by,vendor_table_ref_id,buyer_site_table_ref_id,dealer_site_table_ref_id
2555,2555,Vivamus vestibulum sagittis sapien.,08/02/2022,20/11/2021,2277,4600,3814,2077,4337
2556,2556,"Praesent id massa id nisl venenatis lacinia. Aenean sit amet justo. Morbi ut odio. Cras mi pede, malesuada in, imperdiet et, commodo vulputate, justo. In blandit ultrices enim.",23/03/2022,16/07/2021,346,2928,2693,2781,3323
2557,2557,"Lorem ipsum dolor sit amet, consectetuer adipiscing elit. Proin risus. Praesent lectus.",02/04/2022,12/06/2021,2718,1916,1295,3038,4067
2558,2558,"Duis at velit eu est congue elementum. In hac habitasse platea dictumst. Morbi vestibulum, velit id pretium iaculis, diam erat fermentum justo, nec condimentum neque sapien placerat ante.",26/06/2021,21/06/2021,1394,2300,1811,229,1596
2559,2559,"Nam nulla. Integer pede justo, lacinia eget, tincidunt eget, tempus vel, pede.",26/11/2021,03/04/2022,2976,3454,4819,3328,216
2560,2560,"Integer non velit. Donec diam neque, vestibulum eget, vulputate ut, ultrices vel, augue. Vestibulum ante ipsum primis in faucibus orci luctus et ultrices posuere cubilia Curae; Donec pharetra, magna vestibulum aliquet ultrices, erat tortor sollicitudin mi, sit amet lobortis sapien sapien non mi.",18/11/2021,26/02/2022,3693,686,3257,15,3587
2561,2561,Donec dapibus. Duis at velit eu est congue elementum. In hac habitasse platea dictumst.,29/04/2022,27/05/2022,2181,3323,1926,1126,3944
2562,2562,"Cras pellentesque volutpat dui. Maecenas tristique, est et tempus semper, est quam pharetra magna, ac consequat metus sapien ut nunc. Vestibulum ante ipsum primis in faucibus orci luctus et ultrices posuere cubilia Curae; Mauris viverra diam vitae quam. Suspendisse potenti. Nullam porttitor lacus at turpis.",20/03/2022,27/04/2022,2662,3782,1896,3301,3562
2563,2563,"Proin interdum mauris non ligula pellentesque ultrices. Phasellus id sapien in sapien iaculis congue. Vivamus metus arcu, adipiscing molestie, hendrerit at, vulputate vitae, nisl. Aenean lectus. Pellentesque eget nunc.",08/12/2021,28/05/2022,4437,3193,805,3005,832
2564,2564,Quisque id justo sit amet sapien dignissim vestibulum. Vestibulum ante ipsum primis in faucibus orci luctus et ultrices posuere cubilia Curae; Nulla dapibus dolor vel est.,21/04/2022,23/01/2022,4334,4700,4963,3111,3850
2565,2565,"In blandit ultrices enim. Lorem ipsum dolor sit amet, consectetuer adipiscing elit.",07/04/2022,24/09/2021,149,576,2525,4560,3230
2566,2566,"Nam congue, risus semper porta volutpat, quam pede lobortis ligula, sit amet eleifend pede libero quis orci.",24/08/2021,30/04/2022,1770,4718,2821,4398,1927
2567,2567,Suspendisse potenti. Cras in purus eu magna vulputate luctus.,03/11/2021,26/12/2021,3375,3530,3395,1493,2371
2568,2568,"Pellentesque viverra pede ac diam. Cras pellentesque volutpat dui. Maecenas tristique, est et tempus semper, est quam pharetra magna, ac consequat metus sapien ut nunc.",03/01/2022,02/06/2022,2993,2881,2661,2812,770
2569,2569,Suspendisse accumsan tortor quis turpis.,19/04/2022,05/08/2021,3900,3317,1283,2823,2696
2570,2570,"Nam ultrices, libero non mattis pulvinar, nulla pede ullamcorper augue, a suscipit nulla elit ac nulla. Sed vel enim sit amet nunc viverra dapibus.",12/03/2022,02/11/2021,590,1117,1849,2437,3552
2571,2571,"Duis consequat dui nec nisi volutpat eleifend. Donec ut dolor. Morbi vel lectus in quam fringilla rhoncus. Mauris enim leo, rhoncus sed, vestibulum sit amet, cursus id, turpis. Integer aliquet, massa id lobortis convallis, tortor risus dapibus augue, vel accumsan tellus nisi eu orci.",30/11/2021,23/05/2022,664,3595,437,3353,1559
2572,2572,"Morbi vel lectus in quam fringilla rhoncus. Mauris enim leo, rhoncus sed, vestibulum sit amet, cursus id, turpis.",30/09/2021,20/08/2021,4179,1900,1888,531,1659
2573,2573,Nullam molestie nibh in lectus. Pellentesque at nulla.,10/07/2021,26/03/2022,1075,4279,2250,1022,2442
2574,2574,Morbi non quam nec dui luctus rutrum. Nulla tellus. In sagittis dui vel nisl.,12/03/2022,24/06/2021,929,1948,4756,3559,4792
2575,2575,"Fusce posuere felis sed lacus. Morbi sem mauris, laoreet ut, rhoncus aliquet, pulvinar sed, nisl. Nunc rhoncus dui vel sem. Sed sagittis.",30/07/2021,25/03/2022,3953,4428,4964,3737,1127
2576,2576,"Fusce congue, diam id ornare imperdiet, sapien urna pretium nisl, ut volutpat sapien arcu sed augue. Aliquam erat volutpat. In congue.",25/04/2022,10/05/2022,3753,2814,248,1811,967
2577,2577,"Praesent blandit. Nam nulla. Integer pede justo, lacinia eget, tincidunt eget, tempus vel, pede.",02/03/2022,01/01/2022,4284,3300,3277,2649,2152
2578,2578,"Pellentesque viverra pede ac diam. Cras pellentesque volutpat dui. Maecenas tristique, est et tempus semper, est quam pharetra magna, ac consequat metus sapien ut nunc.",16/10/2021,02/01/2022,65,860,1422,4609,4041
2579,2579,"In tempor, turpis nec euismod scelerisque, quam turpis adipiscing lorem, vitae mattis nibh ligula nec sem.",10/02/2022,16/01/2022,4743,4016,1134,1931,2516
2580,2580,"Aliquam augue quam, sollicitudin vitae, consectetuer eget, rutrum at, lorem. Integer tincidunt ante vel ipsum. Praesent blandit lacinia erat.",11/05/2022,02/10/2021,443,4085,4732,390,2216
2581,2581,"In hac habitasse platea dictumst. Morbi vestibulum, velit id pretium iaculis, diam erat fermentum justo, nec condimentum neque sapien placerat ante. Nulla justo. Aliquam quis turpis eget elit sodales scelerisque.",14/10/2021,09/01/2022,91,288,3438,261,2693
2582,2582,Morbi non quam nec dui luctus rutrum. Nulla tellus. In sagittis dui vel nisl. Duis ac nibh.,09/06/2022,21/07/2021,2517,2370,2601,762,939
2583,2583,"Sed vel enim sit amet nunc viverra dapibus. Nulla suscipit ligula in lacus. Curabitur at ipsum ac tellus semper interdum. Mauris ullamcorper purus sit amet nulla. Quisque arcu libero, rutrum ac, lobortis vel, dapibus at, diam.",09/06/2022,12/03/2022,4563,4154,4989,3619,2303
2584,2584,Duis aliquam convallis nunc. Proin at turpis a pede posuere nonummy.,02/08/2021,26/11/2021,4085,1215,4962,4205,2233
2585,2585,Aliquam non mauris. Morbi non lectus.,20/12/2021,06/01/2022,3264,936,4862,500,2404
2586,2586,Integer tincidunt ante vel ipsum. Praesent blandit lacinia erat. Vestibulum sed magna at nunc commodo placerat. Praesent blandit. Nam nulla.,31/07/2021,09/01/2022,243,1074,1989,4672,244
2587,2587,"Nam nulla. Integer pede justo, lacinia eget, tincidunt eget, tempus vel, pede.",23/08/2021,22/06/2021,529,1435,1127,3722,2795
2588,2588,"Fusce congue, diam id ornare imperdiet, sapien urna pretium nisl, ut volutpat sapien arcu sed augue. Aliquam erat volutpat.",13/03/2022,05/01/2022,2377,378,3540,792,378
2589,2589,In congue. Etiam justo. Etiam pretium iaculis justo. In hac habitasse platea dictumst. Etiam faucibus cursus urna.,16/12/2021,08/06/2022,883,4496,2605,405,3656
2590,2590,"Pellentesque eget nunc. Donec quis orci eget orci vehicula condimentum. Curabitur in libero ut massa volutpat convallis. Morbi odio odio, elementum eu, interdum eu, tincidunt in, leo.",27/01/2022,22/04/2022,4675,2339,33,1092,2851
2591,2591,Sed vel enim sit amet nunc viverra dapibus.,23/07/2021,24/05/2022,115,4244,2482,1615,1476
2592,2592,Nulla justo. Aliquam quis turpis eget elit sodales scelerisque. Mauris sit amet eros. Suspendisse accumsan tortor quis turpis.,02/06/2022,30/12/2021,3579,456,2249,1936,1895
2593,2593,"In blandit ultrices enim. Lorem ipsum dolor sit amet, consectetuer adipiscing elit.",28/02/2022,21/10/2021,2644,129,4274,217,2680
2594,2594,Etiam pretium iaculis justo. In hac habitasse platea dictumst. Etiam faucibus cursus urna. Ut tellus. Nulla ut erat id mauris vulputate elementum.,12/10/2021,16/02/2022,2719,4886,154,4299,1720
2595,2595,"Nunc nisl. Duis bibendum, felis sed interdum venenatis, turpis enim blandit mi, in porttitor pede justo eu massa. Donec dapibus.",29/10/2021,17/10/2021,638,1561,3352,427,4364
2596,2596,"Cras in purus eu magna vulputate luctus. Cum sociis natoque penatibus et magnis dis parturient montes, nascetur ridiculus mus. Vivamus vestibulum sagittis sapien. Cum sociis natoque penatibus et magnis dis parturient montes, nascetur ridiculus mus.",05/09/2021,04/08/2021,3383,696,4624,1552,1976
2597,2597,Curabitur convallis. Duis consequat dui nec nisi volutpat eleifend. Donec ut dolor.,25/04/2022,09/06/2022,150,119,1313,2594,788
2598,2598,Cras non velit nec nisi vulputate nonummy. Maecenas tincidunt lacus at velit.,14/12/2021,14/09/2021,1542,204,3156,4375,43
2599,2599,Fusce posuere felis sed lacus.,24/04/2022,03/06/2022,3853,2679,1316,4189,3576
2600,2600,Sed vel enim sit amet nunc viverra dapibus. Nulla suscipit ligula in lacus. Curabitur at ipsum ac tellus semper interdum.,09/03/2022,15/10/2021,1216,4178,4214,3835,4931
2601,2601,Etiam faucibus cursus urna. Ut tellus. Nulla ut erat id mauris vulputate elementum. Nullam varius.,05/05/2022,21/09/2021,1693,765,3743,540,4523
2602,2602,Sed vel enim sit amet nunc viverra dapibus. Nulla suscipit ligula in lacus. Curabitur at ipsum ac tellus semper interdum. Mauris ullamcorper purus sit amet nulla.,28/12/2021,27/10/2021,1554,3067,2141,4857,3796
2603,2603,Praesent blandit lacinia erat.,19/10/2021,07/08/2021,754,3610,1115,897,4521
2604,2604,"Lorem ipsum dolor sit amet, consectetuer adipiscing elit. Proin risus. Praesent lectus. Vestibulum quam sapien, varius ut, blandit non, interdum in, ante.",19/09/2021,22/11/2021,2596,853,2949,4126,1245
2605,2605,In hac habitasse platea dictumst. Maecenas ut massa quis augue luctus tincidunt. Nulla mollis molestie lorem. Quisque ut erat. Curabitur gravida nisi at nibh.,02/03/2022,07/07/2021,2317,748,4750,4910,139
2606,2606,"Mauris enim leo, rhoncus sed, vestibulum sit amet, cursus id, turpis.",19/01/2022,15/03/2022,2940,1577,4013,4595,580
2607,2607,Nulla tellus. In sagittis dui vel nisl.,06/03/2022,02/03/2022,3095,1998,1441,611,4012
2608,2608,"Morbi vel lectus in quam fringilla rhoncus. Mauris enim leo, rhoncus sed, vestibulum sit amet, cursus id, turpis. Integer aliquet, massa id lobortis convallis, tortor risus dapibus augue, vel accumsan tellus nisi eu orci.",10/07/2021,22/03/2022,4071,4544,3946,4894,444
2609,2609,"Fusce consequat. Nulla nisl. Nunc nisl. Duis bibendum, felis sed interdum venenatis, turpis enim blandit mi, in porttitor pede justo eu massa. Donec dapibus.",08/05/2022,29/06/2021,1083,719,513,2764,1683
2610,2610,"Fusce lacus purus, aliquet at, feugiat non, pretium quis, lectus. Suspendisse potenti. In eleifend quam a odio. In hac habitasse platea dictumst. Maecenas ut massa quis augue luctus tincidunt.",29/09/2021,02/08/2021,1295,172,1523,1179,4864
2611,2611,Aenean auctor gravida sem.,02/07/2021,19/09/2021,4915,3867,1022,3009,3456
2612,2612,Nulla facilisi. Cras non velit nec nisi vulputate nonummy. Maecenas tincidunt lacus at velit. Vivamus vel nulla eget eros elementum pellentesque. Quisque porta volutpat erat.,25/11/2021,26/12/2021,290,3334,4945,3707,3756
2613,2613,"Integer pede justo, lacinia eget, tincidunt eget, tempus vel, pede. Morbi porttitor lorem id ligula. Suspendisse ornare consequat lectus. In est risus, auctor sed, tristique in, tempus sit amet, sem.",19/03/2022,22/12/2021,2867,4491,2781,3673,1049
2614,2614,"Vivamus metus arcu, adipiscing molestie, hendrerit at, vulputate vitae, nisl. Aenean lectus. Pellentesque eget nunc. Donec quis orci eget orci vehicula condimentum. Curabitur in libero ut massa volutpat convallis.",04/12/2021,14/01/2022,3487,1300,3601,4909,1442
2615,2615,Duis aliquam convallis nunc. Proin at turpis a pede posuere nonummy.,08/06/2022,28/12/2021,2365,3045,2893,2982,1399
2616,2616,Praesent id massa id nisl venenatis lacinia. Aenean sit amet justo. Morbi ut odio.,09/05/2022,06/07/2021,4934,2998,2675,3046,1251
2617,2617,Nulla ac enim.,05/12/2021,18/08/2021,1236,4606,2708,4699,4590
2618,2618,Morbi non lectus. Aliquam sit amet diam in magna bibendum imperdiet.,05/06/2022,15/12/2021,4827,3430,524,451,4939
2619,2619,"Proin eu mi. Nulla ac enim. In tempor, turpis nec euismod scelerisque, quam turpis adipiscing lorem, vitae mattis nibh ligula nec sem. Duis aliquam convallis nunc.",16/05/2022,08/05/2022,2052,1478,99,2482,473
2620,2620,Mauris lacinia sapien quis libero. Nullam sit amet turpis elementum ligula vehicula consequat.,07/09/2021,04/08/2021,3125,4130,3362,4469,1355
2621,2621,"Morbi porttitor lorem id ligula. Suspendisse ornare consequat lectus. In est risus, auctor sed, tristique in, tempus sit amet, sem. Fusce consequat. Nulla nisl.",28/07/2021,11/09/2021,1737,4518,982,3011,2203
2622,2622,Donec ut dolor. Morbi vel lectus in quam fringilla rhoncus.,02/10/2021,04/02/2022,1544,1979,4517,446,3000
2623,2623,Pellentesque at nulla.,22/10/2021,31/10/2021,2176,803,1055,2768,3813
2624,2624,"Vivamus vel nulla eget eros elementum pellentesque. Quisque porta volutpat erat. Quisque erat eros, viverra eget, congue eget, semper rutrum, nulla. Nunc purus.",22/08/2021,01/05/2022,2059,493,4780,1304,4681
2625,2625,"Aliquam non mauris. Morbi non lectus. Aliquam sit amet diam in magna bibendum imperdiet. Nullam orci pede, venenatis non, sodales sed, tincidunt eu, felis. Fusce posuere felis sed lacus.",08/08/2021,14/08/2021,4151,211,2691,626,569
2626,2626,Etiam vel augue. Vestibulum rutrum rutrum neque. Aenean auctor gravida sem. Praesent id massa id nisl venenatis lacinia.,10/01/2022,13/12/2021,3040,4338,4367,2303,1974
2627,2627,Etiam faucibus cursus urna. Ut tellus. Nulla ut erat id mauris vulputate elementum.,03/05/2022,12/07/2021,2151,2683,1685,1130,3872
2628,2628,Aliquam quis turpis eget elit sodales scelerisque. Mauris sit amet eros. Suspendisse accumsan tortor quis turpis. Sed ante. Vivamus tortor.,27/04/2022,31/08/2021,2383,2317,4330,720,1975
2629,2629,"Cras mi pede, malesuada in, imperdiet et, commodo vulputate, justo.",07/07/2021,31/01/2022,4831,3410,3166,3274,260
2630,2630,Etiam justo. Etiam pretium iaculis justo. In hac habitasse platea dictumst. Etiam faucibus cursus urna.,19/03/2022,31/05/2022,3628,2113,490,1218,3610
2631,2631,"Nullam orci pede, venenatis non, sodales sed, tincidunt eu, felis. Fusce posuere felis sed lacus. Morbi sem mauris, laoreet ut, rhoncus aliquet, pulvinar sed, nisl. Nunc rhoncus dui vel sem. Sed sagittis.",27/01/2022,07/02/2022,3764,3123,3047,1538,2429
2632,2632,Duis consequat dui nec nisi volutpat eleifend. Donec ut dolor.,06/11/2021,26/10/2021,4375,1076,1424,3970,3845
2633,2633,"Lorem ipsum dolor sit amet, consectetuer adipiscing elit. Proin risus. Praesent lectus. Vestibulum quam sapien, varius ut, blandit non, interdum in, ante. Vestibulum ante ipsum primis in faucibus orci luctus et ultrices posuere cubilia Curae; Duis faucibus accumsan odio.",02/04/2022,25/12/2021,1004,483,4968,2504,4098
2634,2634,Etiam faucibus cursus urna.,27/07/2021,28/06/2021,594,373,2684,1618,3127
2635,2635,"Duis at velit eu est congue elementum. In hac habitasse platea dictumst. Morbi vestibulum, velit id pretium iaculis, diam erat fermentum justo, nec condimentum neque sapien placerat ante. Nulla justo. Aliquam quis turpis eget elit sodales scelerisque.",06/12/2021,23/08/2021,3922,1223,2505,4748,2808
2636,2636,Nulla facilisi. Cras non velit nec nisi vulputate nonummy. Maecenas tincidunt lacus at velit. Vivamus vel nulla eget eros elementum pellentesque. Quisque porta volutpat erat.,07/11/2021,26/05/2022,3591,3188,2513,569,3607
2637,2637,"Donec odio justo, sollicitudin ut, suscipit a, feugiat et, eros. Vestibulum ac est lacinia nisi venenatis tristique.",01/08/2021,16/04/2022,1664,2681,2214,2559,3962
2638,2638,Maecenas pulvinar lobortis est. Phasellus sit amet erat. Nulla tempus. Vivamus in felis eu sapien cursus vestibulum.,03/08/2021,08/02/2022,2500,4534,1512,2069,694
2639,2639,"Vivamus metus arcu, adipiscing molestie, hendrerit at, vulputate vitae, nisl. Aenean lectus. Pellentesque eget nunc.",28/09/2021,23/07/2021,4400,34,1723,1941,3922
2640,2640,Donec posuere metus vitae ipsum. Aliquam non mauris.,25/08/2021,25/12/2021,1800,4924,2529,3233,1228
2641,2641,Vivamus in felis eu sapien cursus vestibulum. Proin eu mi. Nulla ac enim.,26/12/2021,29/09/2021,1082,2012,642,948,848
2642,2642,"Donec semper sapien a libero. Nam dui. Proin leo odio, porttitor id, consequat in, consequat ut, nulla. Sed accumsan felis. Ut at dolor quis odio consequat varius.",19/08/2021,23/11/2021,798,3644,1462,3617,48
2643,2643,Proin eu mi.,04/10/2021,30/08/2021,2225,3630,2037,498,32
2644,2644,"Cum sociis natoque penatibus et magnis dis parturient montes, nascetur ridiculus mus. Vivamus vestibulum sagittis sapien. Cum sociis natoque penatibus et magnis dis parturient montes, nascetur ridiculus mus.",19/09/2021,17/11/2021,1892,1306,1949,1800,1340
2645,2645,Vivamus vel nulla eget eros elementum pellentesque.,18/01/2022,03/10/2021,3752,3283,2823,4096,1374
2646,2646,Nunc purus. Phasellus in felis.,26/08/2021,19/03/2022,770,797,1544,3030,4438
2647,2647,"Integer pede justo, lacinia eget, tincidunt eget, tempus vel, pede. Morbi porttitor lorem id ligula. Suspendisse ornare consequat lectus. In est risus, auctor sed, tristique in, tempus sit amet, sem. Fusce consequat.",09/02/2022,10/10/2021,2231,4627,682,3157,1218
2648,2648,Mauris sit amet eros. Suspendisse accumsan tortor quis turpis.,08/10/2021,16/12/2021,3643,4394,1476,3623,1027
2649,2649,"Vivamus metus arcu, adipiscing molestie, hendrerit at, vulputate vitae, nisl. Aenean lectus.",26/02/2022,04/09/2021,2334,627,4757,3932,3620
2650,2650,Mauris lacinia sapien quis libero. Nullam sit amet turpis elementum ligula vehicula consequat.,09/03/2022,15/02/2022,735,1366,3975,4657,2985
2651,2651,Integer a nibh. In quis justo. Maecenas rhoncus aliquam lacus. Morbi quis tortor id nulla ultrices aliquet.,14/07/2021,20/01/2022,1303,256,1016,1789,2438
2652,2652,Morbi non lectus.,12/09/2021,12/09/2021,4706,4527,3306,1872,4040
2653,2653,Vestibulum ante ipsum primis in faucibus orci luctus et ultrices posuere cubilia Curae; Duis faucibus accumsan odio. Curabitur convallis. Duis consequat dui nec nisi volutpat eleifend. Donec ut dolor.,30/06/2021,06/08/2021,506,2184,2077,2478,3134
2654,2654,Mauris sit amet eros. Suspendisse accumsan tortor quis turpis.,24/11/2021,15/02/2022,4717,4631,644,840,465
2655,2655,Proin at turpis a pede posuere nonummy.,16/01/2022,23/11/2021,4600,4857,1080,3588,1648
2656,2656,"Fusce posuere felis sed lacus. Morbi sem mauris, laoreet ut, rhoncus aliquet, pulvinar sed, nisl.",09/08/2021,20/07/2021,3204,1685,4177,527,1306
2657,2657,"Vivamus metus arcu, adipiscing molestie, hendrerit at, vulputate vitae, nisl.",09/02/2022,07/06/2022,2875,1127,3558,820,1978
2658,2658,Duis aliquam convallis nunc. Proin at turpis a pede posuere nonummy. Integer non velit.,20/04/2022,20/10/2021,3078,2181,2161,3430,469
2659,2659,"Phasellus id sapien in sapien iaculis congue. Vivamus metus arcu, adipiscing molestie, hendrerit at, vulputate vitae, nisl. Aenean lectus.",21/01/2022,10/02/2022,54,468,1857,3110,2390
2660,2660,"Aliquam non mauris. Morbi non lectus. Aliquam sit amet diam in magna bibendum imperdiet. Nullam orci pede, venenatis non, sodales sed, tincidunt eu, felis.",25/08/2021,14/11/2021,4923,2535,4085,1667,3156
2661,2661,"In hac habitasse platea dictumst. Aliquam augue quam, sollicitudin vitae, consectetuer eget, rutrum at, lorem. Integer tincidunt ante vel ipsum.",17/06/2021,06/10/2021,4101,1849,900,4454,4550
2662,2662,Etiam vel augue. Vestibulum rutrum rutrum neque. Aenean auctor gravida sem. Praesent id massa id nisl venenatis lacinia. Aenean sit amet justo.,03/07/2021,28/01/2022,1162,1742,3658,1100,1737
2663,2663,Praesent id massa id nisl venenatis lacinia. Aenean sit amet justo. Morbi ut odio.,12/03/2022,30/03/2022,1410,934,2106,1021,2264
2664,2664,"Aenean sit amet justo. Morbi ut odio. Cras mi pede, malesuada in, imperdiet et, commodo vulputate, justo. In blandit ultrices enim.",19/06/2021,09/03/2022,4948,1929,4713,1500,3106
2665,2665,Proin eu mi.,24/02/2022,03/07/2021,2699,896,715,2639,3423
2666,2666,"Morbi sem mauris, laoreet ut, rhoncus aliquet, pulvinar sed, nisl. Nunc rhoncus dui vel sem.",05/05/2022,28/12/2021,2431,2482,2977,2892,1881
2667,2667,"Vivamus vestibulum sagittis sapien. Cum sociis natoque penatibus et magnis dis parturient montes, nascetur ridiculus mus. Etiam vel augue.",03/12/2021,21/08/2021,3843,3862,3582,4366,2670
2668,2668,"In hac habitasse platea dictumst. Morbi vestibulum, velit id pretium iaculis, diam erat fermentum justo, nec condimentum neque sapien placerat ante. Nulla justo. Aliquam quis turpis eget elit sodales scelerisque. Mauris sit amet eros.",04/08/2021,16/02/2022,856,4906,741,4310,1539
2669,2669,"In quis justo. Maecenas rhoncus aliquam lacus. Morbi quis tortor id nulla ultrices aliquet. Maecenas leo odio, condimentum id, luctus nec, molestie sed, justo.",25/03/2022,20/04/2022,4481,3921,3182,4287,1181
2670,2670,"Phasellus id sapien in sapien iaculis congue. Vivamus metus arcu, adipiscing molestie, hendrerit at, vulputate vitae, nisl.",02/07/2021,26/09/2021,1569,4667,2446,1443,2746
2671,2671,Phasellus in felis. Donec semper sapien a libero.,02/11/2021,12/04/2022,3086,2266,4901,4451,919
2672,2672,"Cum sociis natoque penatibus et magnis dis parturient montes, nascetur ridiculus mus. Etiam vel augue.",01/04/2022,19/07/2021,1601,2727,3255,2399,4414
2673,2673,Nulla tempus. Vivamus in felis eu sapien cursus vestibulum.,07/04/2022,30/05/2022,623,3584,2562,4427,2671
2674,2674,Duis consequat dui nec nisi volutpat eleifend.,27/04/2022,10/03/2022,3893,3429,430,3290,4424
2675,2675,"Mauris enim leo, rhoncus sed, vestibulum sit amet, cursus id, turpis. Integer aliquet, massa id lobortis convallis, tortor risus dapibus augue, vel accumsan tellus nisi eu orci.",21/09/2021,31/05/2022,4805,1858,350,1699,2962
2676,2676,Nullam sit amet turpis elementum ligula vehicula consequat. Morbi a ipsum. Integer a nibh.,10/04/2022,17/09/2021,2060,1083,1007,1450,4589
2677,2677,In eleifend quam a odio.,26/04/2022,02/06/2022,1729,60,2822,89,4264
2678,2678,Vestibulum sed magna at nunc commodo placerat. Praesent blandit. Nam nulla.,18/10/2021,09/12/2021,3584,2092,1207,1147,4799
2679,2679,"Vestibulum ante ipsum primis in faucibus orci luctus et ultrices posuere cubilia Curae; Donec pharetra, magna vestibulum aliquet ultrices, erat tortor sollicitudin mi, sit amet lobortis sapien sapien non mi. Integer ac neque.",13/08/2021,16/11/2021,2970,3680,4785,476,902
2680,2680,Suspendisse potenti.,03/06/2022,23/02/2022,4676,473,4422,4962,1045
2681,2681,"Nunc nisl. Duis bibendum, felis sed interdum venenatis, turpis enim blandit mi, in porttitor pede justo eu massa. Donec dapibus.",29/12/2021,26/03/2022,3677,1988,1802,3982,944
2682,2682,Quisque ut erat. Curabitur gravida nisi at nibh. In hac habitasse platea dictumst.,22/12/2021,02/01/2022,39,808,354,1290,1724
2683,2683,Curabitur at ipsum ac tellus semper interdum. Mauris ullamcorper purus sit amet nulla.,02/08/2021,22/07/2021,3506,3117,407,1212,4545
2684,2684,"In hac habitasse platea dictumst. Morbi vestibulum, velit id pretium iaculis, diam erat fermentum justo, nec condimentum neque sapien placerat ante. Nulla justo. Aliquam quis turpis eget elit sodales scelerisque. Mauris sit amet eros.",27/12/2021,05/09/2021,4671,4923,1982,4335,813
2685,2685,Etiam faucibus cursus urna.,28/08/2021,02/07/2021,3166,2044,1141,509,2160
2686,2686,"Cras in purus eu magna vulputate luctus. Cum sociis natoque penatibus et magnis dis parturient montes, nascetur ridiculus mus. Vivamus vestibulum sagittis sapien. Cum sociis natoque penatibus et magnis dis parturient montes, nascetur ridiculus mus. Etiam vel augue.",28/07/2021,19/04/2022,3630,175,2716,585,273
2687,2687,Etiam pretium iaculis justo.,14/03/2022,16/11/2021,3427,2116,424,3371,2433
2688,2688,"Nam ultrices, libero non mattis pulvinar, nulla pede ullamcorper augue, a suscipit nulla elit ac nulla. Sed vel enim sit amet nunc viverra dapibus. Nulla suscipit ligula in lacus.",28/12/2021,25/01/2022,104,1854,1397,2379,334
2689,2689,"Aliquam sit amet diam in magna bibendum imperdiet. Nullam orci pede, venenatis non, sodales sed, tincidunt eu, felis. Fusce posuere felis sed lacus.",07/04/2022,24/05/2022,3759,941,444,3886,1200
2690,2690,"In blandit ultrices enim. Lorem ipsum dolor sit amet, consectetuer adipiscing elit. Proin interdum mauris non ligula pellentesque ultrices. Phasellus id sapien in sapien iaculis congue. Vivamus metus arcu, adipiscing molestie, hendrerit at, vulputate vitae, nisl.",09/06/2022,14/04/2022,879,4187,1634,2525,4179
2691,2691,"In est risus, auctor sed, tristique in, tempus sit amet, sem.",17/06/2021,10/02/2022,3825,1319,4545,138,3237
2692,2692,Sed ante. Vivamus tortor. Duis mattis egestas metus.,26/06/2021,03/11/2021,613,4144,431,4583,2991
2693,2693,Aenean auctor gravida sem.,20/08/2021,03/01/2022,2460,3206,3782,158,86
2694,2694,Sed accumsan felis. Ut at dolor quis odio consequat varius.,12/08/2021,13/06/2021,1716,476,2742,3888,1965
2695,2695,"Fusce posuere felis sed lacus. Morbi sem mauris, laoreet ut, rhoncus aliquet, pulvinar sed, nisl. Nunc rhoncus dui vel sem.",20/09/2021,24/11/2021,2120,2423,4794,3197,3151
2696,2696,In congue. Etiam justo. Etiam pretium iaculis justo.,14/06/2021,29/04/2022,258,1529,2325,3196,495
2697,2697,"Pellentesque viverra pede ac diam. Cras pellentesque volutpat dui. Maecenas tristique, est et tempus semper, est quam pharetra magna, ac consequat metus sapien ut nunc.",19/08/2021,30/08/2021,27,3589,1470,3879,2227
2698,2698,"Cras in purus eu magna vulputate luctus. Cum sociis natoque penatibus et magnis dis parturient montes, nascetur ridiculus mus. Vivamus vestibulum sagittis sapien. Cum sociis natoque penatibus et magnis dis parturient montes, nascetur ridiculus mus.",05/02/2022,18/09/2021,3898,3512,2951,646,2898
2699,2699,"Fusce consequat. Nulla nisl. Nunc nisl. Duis bibendum, felis sed interdum venenatis, turpis enim blandit mi, in porttitor pede justo eu massa.",21/11/2021,17/04/2022,1953,1822,3827,176,4791
