id,user_id,description,start_date,end_date,created_by,updated_by,vendor_table_ref_id,buyer_site_table_ref_id,dealer_site_table_ref_id
1304,1304,"Integer pede justo, lacinia eget, tincidunt eget, tempus vel, pede.",09/02/2022,16/10/2021,733,1287,166,1824,2447
1305,1305,Duis consequat dui nec nisi volutpat eleifend. Donec ut dolor.,07/07/2021,25/02/2022,3219,1763,3819,3944,2825
1306,1306,"Suspendisse potenti. Cras in purus eu magna vulputate luctus. Cum sociis natoque penatibus et magnis dis parturient montes, nascetur ridiculus mus.",01/05/2022,29/11/2021,1443,204,3222,2314,3698
1307,1307,"Curabitur gravida nisi at nibh. In hac habitasse platea dictumst. Aliquam augue quam, sollicitudin vitae, consectetuer eget, rutrum at, lorem.",25/01/2022,14/07/2021,1939,4404,3576,4649,838
1308,1308,"Duis ac nibh. Fusce lacus purus, aliquet at, feugiat non, pretium quis, lectus.",08/03/2022,22/07/2021,1306,2984,4666,2140,3298
1309,1309,Nulla ac enim.,14/03/2022,14/12/2021,4564,1323,1381,1117,3420
1310,1310,"Curabitur in libero ut massa volutpat convallis. Morbi odio odio, elementum eu, interdum eu, tincidunt in, leo. Maecenas pulvinar lobortis est.",07/12/2021,21/10/2021,2217,3454,2599,4203,336
1311,1311,Nullam molestie nibh in lectus.,26/07/2021,07/07/2021,998,175,2111,3783,4329
1312,1312,"Duis ac nibh. Fusce lacus purus, aliquet at, feugiat non, pretium quis, lectus. Suspendisse potenti. In eleifend quam a odio.",21/08/2021,22/07/2021,3985,3491,192,2838,4559
1313,1313,"Vestibulum quam sapien, varius ut, blandit non, interdum in, ante. Vestibulum ante ipsum primis in faucibus orci luctus et ultrices posuere cubilia Curae; Duis faucibus accumsan odio. Curabitur convallis. Duis consequat dui nec nisi volutpat eleifend. Donec ut dolor.",03/10/2021,16/12/2021,4267,1649,2830,3101,3079
1314,1314,"Nulla neque libero, convallis eget, eleifend luctus, ultricies eu, nibh. Quisque id justo sit amet sapien dignissim vestibulum. Vestibulum ante ipsum primis in faucibus orci luctus et ultrices posuere cubilia Curae; Nulla dapibus dolor vel est. Donec odio justo, sollicitudin ut, suscipit a, feugiat et, eros.",22/01/2022,31/07/2021,4455,526,1246,4153,3709
1315,1315,"Vivamus vel nulla eget eros elementum pellentesque. Quisque porta volutpat erat. Quisque erat eros, viverra eget, congue eget, semper rutrum, nulla. Nunc purus. Phasellus in felis.",03/07/2021,26/06/2021,986,3195,4894,4489,2784
1316,1316,"Suspendisse potenti. Cras in purus eu magna vulputate luctus. Cum sociis natoque penatibus et magnis dis parturient montes, nascetur ridiculus mus. Vivamus vestibulum sagittis sapien. Cum sociis natoque penatibus et magnis dis parturient montes, nascetur ridiculus mus.",18/12/2021,12/05/2022,4377,636,1318,1389,1438
1317,1317,"Sed sagittis. Nam congue, risus semper porta volutpat, quam pede lobortis ligula, sit amet eleifend pede libero quis orci. Nullam molestie nibh in lectus. Pellentesque at nulla. Suspendisse potenti.",13/10/2021,24/10/2021,2982,4553,2820,4914,1415
1318,1318,Morbi non lectus. Aliquam sit amet diam in magna bibendum imperdiet.,28/07/2021,23/04/2022,2335,4695,90,3702,4628
1319,1319,"Nulla tellus. In sagittis dui vel nisl. Duis ac nibh. Fusce lacus purus, aliquet at, feugiat non, pretium quis, lectus.",19/12/2021,27/07/2021,2626,2415,3504,857,1566
1320,1320,Etiam vel augue. Vestibulum rutrum rutrum neque.,24/04/2022,23/08/2021,8,1371,4096,3368,2743
1321,1321,"Proin leo odio, porttitor id, consequat in, consequat ut, nulla. Sed accumsan felis. Ut at dolor quis odio consequat varius. Integer ac leo. Pellentesque ultrices mattis odio.",10/01/2022,02/07/2021,1947,1388,1377,1185,3910
1322,1322,Donec ut mauris eget massa tempor convallis.,02/07/2021,02/01/2022,3402,4396,3987,4241,2596
1323,1323,Integer a nibh. In quis justo.,02/03/2022,09/11/2021,4889,2522,4692,3155,2873
1324,1324,"Integer non velit. Donec diam neque, vestibulum eget, vulputate ut, ultrices vel, augue. Vestibulum ante ipsum primis in faucibus orci luctus et ultrices posuere cubilia Curae; Donec pharetra, magna vestibulum aliquet ultrices, erat tortor sollicitudin mi, sit amet lobortis sapien sapien non mi. Integer ac neque.",16/11/2021,09/05/2022,2176,2938,2984,921,4023
1325,1325,"Nulla neque libero, convallis eget, eleifend luctus, ultricies eu, nibh. Quisque id justo sit amet sapien dignissim vestibulum. Vestibulum ante ipsum primis in faucibus orci luctus et ultrices posuere cubilia Curae; Nulla dapibus dolor vel est.",11/07/2021,15/08/2021,1879,4565,3281,3518,4975
1326,1326,In hac habitasse platea dictumst.,06/07/2021,14/10/2021,3344,3818,4363,4096,4245
1327,1327,"Praesent lectus. Vestibulum quam sapien, varius ut, blandit non, interdum in, ante.",07/07/2021,24/05/2022,3252,1086,4587,2240,3567
1328,1328,"Phasellus id sapien in sapien iaculis congue. Vivamus metus arcu, adipiscing molestie, hendrerit at, vulputate vitae, nisl. Aenean lectus. Pellentesque eget nunc. Donec quis orci eget orci vehicula condimentum.",25/02/2022,07/04/2022,3647,1124,326,4528,1688
1329,1329,"Morbi sem mauris, laoreet ut, rhoncus aliquet, pulvinar sed, nisl. Nunc rhoncus dui vel sem. Sed sagittis. Nam congue, risus semper porta volutpat, quam pede lobortis ligula, sit amet eleifend pede libero quis orci.",09/01/2022,25/01/2022,3007,4105,3295,1040,3557
1330,1330,Proin at turpis a pede posuere nonummy.,26/05/2022,29/11/2021,1720,2088,2880,965,811
1331,1331,"Quisque ut erat. Curabitur gravida nisi at nibh. In hac habitasse platea dictumst. Aliquam augue quam, sollicitudin vitae, consectetuer eget, rutrum at, lorem. Integer tincidunt ante vel ipsum.",29/04/2022,30/04/2022,1509,3081,1893,2498,394
1332,1332,Nulla facilisi. Cras non velit nec nisi vulputate nonummy. Maecenas tincidunt lacus at velit. Vivamus vel nulla eget eros elementum pellentesque. Quisque porta volutpat erat.,11/02/2022,16/07/2021,2212,89,3085,1364,2097
1333,1333,"Integer aliquet, massa id lobortis convallis, tortor risus dapibus augue, vel accumsan tellus nisi eu orci. Mauris lacinia sapien quis libero. Nullam sit amet turpis elementum ligula vehicula consequat.",23/06/2021,08/09/2021,1605,107,1927,496,982
1334,1334,Fusce posuere felis sed lacus.,14/06/2021,29/09/2021,1022,1351,721,4490,4741
1335,1335,"Morbi non lectus. Aliquam sit amet diam in magna bibendum imperdiet. Nullam orci pede, venenatis non, sodales sed, tincidunt eu, felis.",02/09/2021,21/06/2021,321,2965,2931,4274,634
1336,1336,Nulla mollis molestie lorem. Quisque ut erat.,24/09/2021,22/11/2021,3621,1832,2074,3053,2119
1337,1337,"Nulla nisl. Nunc nisl. Duis bibendum, felis sed interdum venenatis, turpis enim blandit mi, in porttitor pede justo eu massa. Donec dapibus. Duis at velit eu est congue elementum.",30/04/2022,29/12/2021,3912,880,4573,4990,1941
1338,1338,Morbi a ipsum. Integer a nibh. In quis justo. Maecenas rhoncus aliquam lacus. Morbi quis tortor id nulla ultrices aliquet.,04/02/2022,25/01/2022,4639,3858,2769,3424,4226
1339,1339,"Fusce consequat. Nulla nisl. Nunc nisl. Duis bibendum, felis sed interdum venenatis, turpis enim blandit mi, in porttitor pede justo eu massa. Donec dapibus.",17/03/2022,26/04/2022,1690,2420,816,3300,1932
1340,1340,Sed vel enim sit amet nunc viverra dapibus. Nulla suscipit ligula in lacus. Curabitur at ipsum ac tellus semper interdum.,17/11/2021,04/06/2022,4652,4800,3710,4833,3852
1341,1341,"Morbi porttitor lorem id ligula. Suspendisse ornare consequat lectus. In est risus, auctor sed, tristique in, tempus sit amet, sem.",05/01/2022,11/02/2022,680,4837,2348,3819,3959
1342,1342,Maecenas ut massa quis augue luctus tincidunt. Nulla mollis molestie lorem.,04/07/2021,05/03/2022,2361,633,2613,3258,1540
1343,1343,"Nam nulla. Integer pede justo, lacinia eget, tincidunt eget, tempus vel, pede. Morbi porttitor lorem id ligula. Suspendisse ornare consequat lectus. In est risus, auctor sed, tristique in, tempus sit amet, sem.",13/08/2021,13/06/2021,1767,2235,1784,2209,586
1344,1344,"Nam ultrices, libero non mattis pulvinar, nulla pede ullamcorper augue, a suscipit nulla elit ac nulla. Sed vel enim sit amet nunc viverra dapibus. Nulla suscipit ligula in lacus. Curabitur at ipsum ac tellus semper interdum. Mauris ullamcorper purus sit amet nulla.",09/01/2022,30/06/2021,444,4493,3884,3057,4008
1345,1345,"Vestibulum ac est lacinia nisi venenatis tristique. Fusce congue, diam id ornare imperdiet, sapien urna pretium nisl, ut volutpat sapien arcu sed augue. Aliquam erat volutpat.",07/02/2022,14/03/2022,4928,1468,2957,1745,54
1346,1346,"Vestibulum ante ipsum primis in faucibus orci luctus et ultrices posuere cubilia Curae; Donec pharetra, magna vestibulum aliquet ultrices, erat tortor sollicitudin mi, sit amet lobortis sapien sapien non mi.",28/03/2022,30/01/2022,1611,1483,180,4401,2230
1347,1347,"Vivamus metus arcu, adipiscing molestie, hendrerit at, vulputate vitae, nisl. Aenean lectus.",25/02/2022,31/01/2022,2854,2933,3333,616,1124
1348,1348,"Nulla nisl. Nunc nisl. Duis bibendum, felis sed interdum venenatis, turpis enim blandit mi, in porttitor pede justo eu massa. Donec dapibus. Duis at velit eu est congue elementum.",14/05/2022,16/05/2022,3663,3539,2277,205,654
1349,1349,Donec dapibus.,18/11/2021,05/04/2022,4417,4391,2469,1239,3528
1350,1350,Aenean lectus. Pellentesque eget nunc. Donec quis orci eget orci vehicula condimentum.,17/03/2022,27/09/2021,2676,1711,3162,3226,3917
1351,1351,"Vestibulum ante ipsum primis in faucibus orci luctus et ultrices posuere cubilia Curae; Nulla dapibus dolor vel est. Donec odio justo, sollicitudin ut, suscipit a, feugiat et, eros. Vestibulum ac est lacinia nisi venenatis tristique.",17/07/2021,24/07/2021,937,2878,3112,291,4286
1352,1352,"Proin leo odio, porttitor id, consequat in, consequat ut, nulla. Sed accumsan felis. Ut at dolor quis odio consequat varius. Integer ac leo.",23/01/2022,26/02/2022,1467,4277,1060,2566,880
1353,1353,"Cum sociis natoque penatibus et magnis dis parturient montes, nascetur ridiculus mus. Etiam vel augue. Vestibulum rutrum rutrum neque. Aenean auctor gravida sem. Praesent id massa id nisl venenatis lacinia.",30/12/2021,07/10/2021,2107,875,2580,2530,2260
1354,1354,"Quisque id justo sit amet sapien dignissim vestibulum. Vestibulum ante ipsum primis in faucibus orci luctus et ultrices posuere cubilia Curae; Nulla dapibus dolor vel est. Donec odio justo, sollicitudin ut, suscipit a, feugiat et, eros. Vestibulum ac est lacinia nisi venenatis tristique.",18/06/2021,17/10/2021,1492,4997,3997,2017,1246
1355,1355,Nulla tellus. In sagittis dui vel nisl.,19/12/2021,12/11/2021,499,2858,2066,4014,3313
1356,1356,Praesent blandit lacinia erat. Vestibulum sed magna at nunc commodo placerat. Praesent blandit. Nam nulla.,08/06/2022,05/01/2022,1608,4923,2405,4843,2936
1357,1357,"Praesent lectus. Vestibulum quam sapien, varius ut, blandit non, interdum in, ante. Vestibulum ante ipsum primis in faucibus orci luctus et ultrices posuere cubilia Curae; Duis faucibus accumsan odio.",03/02/2022,20/04/2022,2760,4577,3578,4693,809
1358,1358,"Aliquam non mauris. Morbi non lectus. Aliquam sit amet diam in magna bibendum imperdiet. Nullam orci pede, venenatis non, sodales sed, tincidunt eu, felis. Fusce posuere felis sed lacus.",30/09/2021,13/07/2021,1000,3463,3671,2315,410
1359,1359,"Nulla ac enim. In tempor, turpis nec euismod scelerisque, quam turpis adipiscing lorem, vitae mattis nibh ligula nec sem. Duis aliquam convallis nunc. Proin at turpis a pede posuere nonummy. Integer non velit.",27/12/2021,18/07/2021,16,4407,4770,4418,2762
1360,1360,Cras non velit nec nisi vulputate nonummy. Maecenas tincidunt lacus at velit.,25/06/2021,07/12/2021,1796,1384,4100,2969,295
1361,1361,"Fusce posuere felis sed lacus. Morbi sem mauris, laoreet ut, rhoncus aliquet, pulvinar sed, nisl. Nunc rhoncus dui vel sem. Sed sagittis. Nam congue, risus semper porta volutpat, quam pede lobortis ligula, sit amet eleifend pede libero quis orci.",13/11/2021,13/07/2021,3644,3329,2114,4197,1731
1362,1362,"Morbi sem mauris, laoreet ut, rhoncus aliquet, pulvinar sed, nisl. Nunc rhoncus dui vel sem. Sed sagittis.",26/03/2022,22/10/2021,1078,76,3233,4887,978
1363,1363,Nunc purus. Phasellus in felis. Donec semper sapien a libero. Nam dui.,26/09/2021,18/08/2021,1057,2937,4933,3377,107
1364,1364,"Maecenas leo odio, condimentum id, luctus nec, molestie sed, justo. Pellentesque viverra pede ac diam. Cras pellentesque volutpat dui. Maecenas tristique, est et tempus semper, est quam pharetra magna, ac consequat metus sapien ut nunc. Vestibulum ante ipsum primis in faucibus orci luctus et ultrices posuere cubilia Curae; Mauris viverra diam vitae quam.",30/01/2022,02/11/2021,1718,1387,58,1805,970
1365,1365,"In hac habitasse platea dictumst. Morbi vestibulum, velit id pretium iaculis, diam erat fermentum justo, nec condimentum neque sapien placerat ante. Nulla justo. Aliquam quis turpis eget elit sodales scelerisque.",05/04/2022,18/01/2022,3867,3803,2002,170,3633
1366,1366,Integer a nibh. In quis justo. Maecenas rhoncus aliquam lacus.,06/05/2022,19/10/2021,3008,2817,4637,3919,77
1367,1367,Donec semper sapien a libero. Nam dui.,26/03/2022,18/11/2021,2143,3363,3594,3695,284
1368,1368,"In est risus, auctor sed, tristique in, tempus sit amet, sem. Fusce consequat. Nulla nisl. Nunc nisl. Duis bibendum, felis sed interdum venenatis, turpis enim blandit mi, in porttitor pede justo eu massa.",12/11/2021,15/04/2022,2547,165,3879,480,1158
1369,1369,"Duis ac nibh. Fusce lacus purus, aliquet at, feugiat non, pretium quis, lectus. Suspendisse potenti. In eleifend quam a odio. In hac habitasse platea dictumst.",17/11/2021,31/08/2021,4489,1368,1324,961,1351
1370,1370,Nullam sit amet turpis elementum ligula vehicula consequat.,01/02/2022,24/05/2022,353,1295,1780,1128,3232
1371,1371,Nulla justo. Aliquam quis turpis eget elit sodales scelerisque.,05/05/2022,12/07/2021,1021,4513,3321,2791,2486
1372,1372,"Donec odio justo, sollicitudin ut, suscipit a, feugiat et, eros. Vestibulum ac est lacinia nisi venenatis tristique. Fusce congue, diam id ornare imperdiet, sapien urna pretium nisl, ut volutpat sapien arcu sed augue. Aliquam erat volutpat.",08/04/2022,22/08/2021,4844,822,2603,2743,2163
1373,1373,Vivamus vel nulla eget eros elementum pellentesque.,30/12/2021,23/02/2022,993,2718,747,1997,3021
1374,1374,Etiam faucibus cursus urna. Ut tellus.,11/01/2022,15/04/2022,1771,1882,251,2994,1521
1375,1375,"Vestibulum ante ipsum primis in faucibus orci luctus et ultrices posuere cubilia Curae; Donec pharetra, magna vestibulum aliquet ultrices, erat tortor sollicitudin mi, sit amet lobortis sapien sapien non mi. Integer ac neque. Duis bibendum. Morbi non quam nec dui luctus rutrum.",18/02/2022,30/01/2022,192,3335,4786,207,3460
1376,1376,"In tempor, turpis nec euismod scelerisque, quam turpis adipiscing lorem, vitae mattis nibh ligula nec sem.",09/08/2021,01/10/2021,2646,3331,413,4880,1532
1377,1377,Vestibulum ante ipsum primis in faucibus orci luctus et ultrices posuere cubilia Curae; Nulla dapibus dolor vel est.,30/01/2022,03/12/2021,574,1370,1836,1763,4001
1378,1378,"Duis consequat dui nec nisi volutpat eleifend. Donec ut dolor. Morbi vel lectus in quam fringilla rhoncus. Mauris enim leo, rhoncus sed, vestibulum sit amet, cursus id, turpis. Integer aliquet, massa id lobortis convallis, tortor risus dapibus augue, vel accumsan tellus nisi eu orci.",11/04/2022,22/11/2021,1793,2617,993,4317,4009
1379,1379,"Vivamus in felis eu sapien cursus vestibulum. Proin eu mi. Nulla ac enim. In tempor, turpis nec euismod scelerisque, quam turpis adipiscing lorem, vitae mattis nibh ligula nec sem.",11/05/2022,30/06/2021,3033,1398,2251,2555,2291
1380,1380,"Curabitur gravida nisi at nibh. In hac habitasse platea dictumst. Aliquam augue quam, sollicitudin vitae, consectetuer eget, rutrum at, lorem. Integer tincidunt ante vel ipsum.",17/09/2021,14/05/2022,968,2529,757,637,3094
1381,1381,Morbi a ipsum. Integer a nibh. In quis justo.,14/08/2021,31/03/2022,1500,3024,1653,3182,4929
1382,1382,"Aenean fermentum. Donec ut mauris eget massa tempor convallis. Nulla neque libero, convallis eget, eleifend luctus, ultricies eu, nibh. Quisque id justo sit amet sapien dignissim vestibulum. Vestibulum ante ipsum primis in faucibus orci luctus et ultrices posuere cubilia Curae; Nulla dapibus dolor vel est.",22/10/2021,03/03/2022,4101,433,4451,1411,2157
1383,1383,"Cum sociis natoque penatibus et magnis dis parturient montes, nascetur ridiculus mus. Vivamus vestibulum sagittis sapien. Cum sociis natoque penatibus et magnis dis parturient montes, nascetur ridiculus mus. Etiam vel augue. Vestibulum rutrum rutrum neque.",09/05/2022,16/02/2022,4346,982,606,638,3493
1384,1384,"Morbi ut odio. Cras mi pede, malesuada in, imperdiet et, commodo vulputate, justo.",24/02/2022,06/01/2022,896,3142,625,1073,4873
1385,1385,"Cras in purus eu magna vulputate luctus. Cum sociis natoque penatibus et magnis dis parturient montes, nascetur ridiculus mus. Vivamus vestibulum sagittis sapien. Cum sociis natoque penatibus et magnis dis parturient montes, nascetur ridiculus mus. Etiam vel augue.",23/10/2021,05/05/2022,4792,1056,1597,1841,4778
1386,1386,"Integer ac leo. Pellentesque ultrices mattis odio. Donec vitae nisi. Nam ultrices, libero non mattis pulvinar, nulla pede ullamcorper augue, a suscipit nulla elit ac nulla. Sed vel enim sit amet nunc viverra dapibus.",04/07/2021,26/02/2022,203,2153,1768,1667,2536
1387,1387,"Mauris enim leo, rhoncus sed, vestibulum sit amet, cursus id, turpis. Integer aliquet, massa id lobortis convallis, tortor risus dapibus augue, vel accumsan tellus nisi eu orci. Mauris lacinia sapien quis libero.",06/12/2021,19/07/2021,3060,375,2544,440,2105
1388,1388,Curabitur convallis.,17/07/2021,17/10/2021,2806,1061,2274,3612,4098
1389,1389,"Praesent lectus. Vestibulum quam sapien, varius ut, blandit non, interdum in, ante. Vestibulum ante ipsum primis in faucibus orci luctus et ultrices posuere cubilia Curae; Duis faucibus accumsan odio. Curabitur convallis.",28/10/2021,17/07/2021,1385,3783,439,1022,4842
1390,1390,"Pellentesque eget nunc. Donec quis orci eget orci vehicula condimentum. Curabitur in libero ut massa volutpat convallis. Morbi odio odio, elementum eu, interdum eu, tincidunt in, leo. Maecenas pulvinar lobortis est.",09/06/2022,18/08/2021,1292,3498,4183,2723,1393
1391,1391,Vestibulum sed magna at nunc commodo placerat. Praesent blandit. Nam nulla.,01/04/2022,06/03/2022,3981,4148,2635,4972,3317
1392,1392,Nam nulla.,01/11/2021,03/01/2022,1559,2768,2146,3438,535
1393,1393,Quisque porta volutpat erat.,31/12/2021,25/12/2021,4979,3848,1478,4180,530
1394,1394,"Nam nulla. Integer pede justo, lacinia eget, tincidunt eget, tempus vel, pede. Morbi porttitor lorem id ligula.",02/10/2021,15/01/2022,1757,1607,4560,3020,3881
1395,1395,Nulla facilisi. Cras non velit nec nisi vulputate nonummy.,02/11/2021,28/09/2021,861,2710,2070,4187,3533
1396,1396,"Quisque ut erat. Curabitur gravida nisi at nibh. In hac habitasse platea dictumst. Aliquam augue quam, sollicitudin vitae, consectetuer eget, rutrum at, lorem. Integer tincidunt ante vel ipsum.",28/10/2021,01/12/2021,2388,4172,3185,2543,4231
1397,1397,"Nam ultrices, libero non mattis pulvinar, nulla pede ullamcorper augue, a suscipit nulla elit ac nulla. Sed vel enim sit amet nunc viverra dapibus.",12/07/2021,19/11/2021,4475,3709,2069,1976,4209
1398,1398,Nulla mollis molestie lorem. Quisque ut erat. Curabitur gravida nisi at nibh. In hac habitasse platea dictumst.,05/10/2021,29/01/2022,4984,1913,2212,2622,1989
1399,1399,Sed vel enim sit amet nunc viverra dapibus. Nulla suscipit ligula in lacus. Curabitur at ipsum ac tellus semper interdum. Mauris ullamcorper purus sit amet nulla.,09/05/2022,22/06/2021,3438,549,204,824,2155
1400,1400,Integer ac leo.,04/03/2022,10/08/2021,3678,1925,1120,4905,3184
1401,1401,Nulla ac enim.,30/08/2021,28/07/2021,221,762,2618,2859,239
1402,1402,Vestibulum rutrum rutrum neque. Aenean auctor gravida sem.,02/09/2021,23/03/2022,2768,4863,2003,2117,1280
1403,1403,"Nam nulla. Integer pede justo, lacinia eget, tincidunt eget, tempus vel, pede.",12/03/2022,05/10/2021,2214,581,874,1687,1894
1404,1404,Etiam pretium iaculis justo. In hac habitasse platea dictumst. Etiam faucibus cursus urna.,20/10/2021,23/09/2021,3511,3130,457,4167,1108
1405,1405,"Maecenas tristique, est et tempus semper, est quam pharetra magna, ac consequat metus sapien ut nunc. Vestibulum ante ipsum primis in faucibus orci luctus et ultrices posuere cubilia Curae; Mauris viverra diam vitae quam. Suspendisse potenti.",04/05/2022,15/03/2022,3270,1215,2122,734,1663
1406,1406,"In hac habitasse platea dictumst. Morbi vestibulum, velit id pretium iaculis, diam erat fermentum justo, nec condimentum neque sapien placerat ante. Nulla justo.",05/07/2021,05/03/2022,4084,180,524,4959,2024
1407,1407,Donec quis orci eget orci vehicula condimentum. Curabitur in libero ut massa volutpat convallis.,17/09/2021,12/03/2022,1948,3486,4980,1481,4463
1408,1408,Nulla facilisi.,04/03/2022,24/11/2021,3416,671,3270,1230,709
1409,1409,Vivamus in felis eu sapien cursus vestibulum. Proin eu mi.,18/09/2021,09/09/2021,2370,4026,3024,4742,4614
1410,1410,"Phasellus id sapien in sapien iaculis congue. Vivamus metus arcu, adipiscing molestie, hendrerit at, vulputate vitae, nisl. Aenean lectus.",18/12/2021,19/05/2022,1236,2226,1149,4758,2078
1411,1411,"Quisque id justo sit amet sapien dignissim vestibulum. Vestibulum ante ipsum primis in faucibus orci luctus et ultrices posuere cubilia Curae; Nulla dapibus dolor vel est. Donec odio justo, sollicitudin ut, suscipit a, feugiat et, eros.",07/08/2021,30/11/2021,4289,987,656,2361,2502
1412,1412,Morbi non quam nec dui luctus rutrum. Nulla tellus.,11/10/2021,06/10/2021,785,3479,1131,122,4746
1413,1413,Integer ac leo. Pellentesque ultrices mattis odio.,24/02/2022,14/05/2022,1220,3541,4317,3970,3809
1414,1414,"Lorem ipsum dolor sit amet, consectetuer adipiscing elit. Proin risus. Praesent lectus. Vestibulum quam sapien, varius ut, blandit non, interdum in, ante. Vestibulum ante ipsum primis in faucibus orci luctus et ultrices posuere cubilia Curae; Duis faucibus accumsan odio.",08/01/2022,03/03/2022,4144,802,1742,2651,294
1415,1415,In sagittis dui vel nisl. Duis ac nibh.,11/06/2022,31/01/2022,3769,3161,3693,1426,2563
1416,1416,Nulla justo. Aliquam quis turpis eget elit sodales scelerisque. Mauris sit amet eros.,27/02/2022,12/04/2022,2521,1548,1411,582,1485
1417,1417,Duis mattis egestas metus. Aenean fermentum. Donec ut mauris eget massa tempor convallis.,21/01/2022,04/01/2022,830,121,1475,4705,1394
1418,1418,"Quisque arcu libero, rutrum ac, lobortis vel, dapibus at, diam. Nam tristique tortor eu pede.",14/11/2021,22/06/2021,3732,4400,3248,2428,4444
1419,1419,"Nulla mollis molestie lorem. Quisque ut erat. Curabitur gravida nisi at nibh. In hac habitasse platea dictumst. Aliquam augue quam, sollicitudin vitae, consectetuer eget, rutrum at, lorem.",08/08/2021,19/08/2021,127,4735,1855,1250,301
1420,1420,Proin interdum mauris non ligula pellentesque ultrices.,25/02/2022,26/12/2021,2357,3169,2804,94,3334
1421,1421,Suspendisse accumsan tortor quis turpis. Sed ante. Vivamus tortor.,27/09/2021,11/05/2022,117,1511,2118,3559,4039
1422,1422,Curabitur convallis.,03/04/2022,06/02/2022,569,501,505,473,570
1423,1423,Etiam pretium iaculis justo. In hac habitasse platea dictumst.,01/03/2022,16/02/2022,1364,4848,2899,1795,2420
1424,1424,"Morbi porttitor lorem id ligula. Suspendisse ornare consequat lectus. In est risus, auctor sed, tristique in, tempus sit amet, sem.",09/11/2021,20/01/2022,4641,841,1363,4012,2983
1425,1425,Integer a nibh. In quis justo.,12/04/2022,10/07/2021,2738,1478,4428,1043,2934
1426,1426,"Vivamus metus arcu, adipiscing molestie, hendrerit at, vulputate vitae, nisl. Aenean lectus. Pellentesque eget nunc. Donec quis orci eget orci vehicula condimentum. Curabitur in libero ut massa volutpat convallis.",03/12/2021,27/06/2021,2657,3107,499,4114,3909
1427,1427,Duis mattis egestas metus.,07/11/2021,18/10/2021,512,4701,2727,3581,3639
1428,1428,Vivamus in felis eu sapien cursus vestibulum.,07/06/2022,22/07/2021,4741,3038,2754,1165,3272
1429,1429,"Nullam orci pede, venenatis non, sodales sed, tincidunt eu, felis. Fusce posuere felis sed lacus. Morbi sem mauris, laoreet ut, rhoncus aliquet, pulvinar sed, nisl. Nunc rhoncus dui vel sem.",02/07/2021,07/02/2022,3840,501,3306,169,1278
1430,1430,Praesent blandit lacinia erat. Vestibulum sed magna at nunc commodo placerat. Praesent blandit. Nam nulla.,04/10/2021,09/02/2022,1335,4499,190,636,3297
1431,1431,In hac habitasse platea dictumst.,07/09/2021,23/05/2022,4097,2144,4961,1932,1793
1432,1432,"Suspendisse ornare consequat lectus. In est risus, auctor sed, tristique in, tempus sit amet, sem.",14/08/2021,27/02/2022,1968,4065,1107,1645,112
1433,1433,Proin interdum mauris non ligula pellentesque ultrices. Phasellus id sapien in sapien iaculis congue.,31/01/2022,02/03/2022,3024,4473,1604,1842,3300
1434,1434,Curabitur gravida nisi at nibh. In hac habitasse platea dictumst.,16/12/2021,09/04/2022,4472,2709,1244,2307,2270
1435,1435,"Phasellus in felis. Donec semper sapien a libero. Nam dui. Proin leo odio, porttitor id, consequat in, consequat ut, nulla.",18/04/2022,02/05/2022,2818,1753,4185,1126,1869
1436,1436,In hac habitasse platea dictumst. Etiam faucibus cursus urna. Ut tellus.,20/12/2021,26/07/2021,613,4154,3713,987,1833
1437,1437,Nulla facilisi.,01/11/2021,08/07/2021,4362,4846,155,1206,4241
1438,1438,Etiam faucibus cursus urna. Ut tellus.,08/12/2021,06/05/2022,3504,970,4759,2547,3289
1439,1439,Nullam varius. Nulla facilisi. Cras non velit nec nisi vulputate nonummy. Maecenas tincidunt lacus at velit. Vivamus vel nulla eget eros elementum pellentesque.,18/12/2021,20/10/2021,1137,4119,2032,4478,3900
1440,1440,"Proin at turpis a pede posuere nonummy. Integer non velit. Donec diam neque, vestibulum eget, vulputate ut, ultrices vel, augue.",07/06/2022,09/10/2021,1536,346,4264,4682,3532
