id,user_id,description,start_date,end_date,created_by,updated_by,vendor_table_ref_id,buyer_site_table_ref_id,dealer_site_table_ref_id
3701,3701,In hac habitasse platea dictumst. Etiam faucibus cursus urna. Ut tellus. Nulla ut erat id mauris vulputate elementum.,12/02/2022,30/06/2021,2831,4047,3072,1652,1481
3702,3702,"Pellentesque ultrices mattis odio. Donec vitae nisi. Nam ultrices, libero non mattis pulvinar, nulla pede ullamcorper augue, a suscipit nulla elit ac nulla. Sed vel enim sit amet nunc viverra dapibus. Nulla suscipit ligula in lacus.",29/04/2022,01/11/2021,3568,2105,3491,3232,3055
3703,3703,Aenean sit amet justo.,13/03/2022,28/03/2022,3547,4819,803,1252,3107
3704,3704,In hac habitasse platea dictumst. Etiam faucibus cursus urna.,20/01/2022,24/09/2021,3108,324,4843,427,1584
3705,3705,Sed vel enim sit amet nunc viverra dapibus. Nulla suscipit ligula in lacus. Curabitur at ipsum ac tellus semper interdum. Mauris ullamcorper purus sit amet nulla.,26/12/2021,30/12/2021,4091,480,256,1585,1744
3706,3706,Quisque ut erat. Curabitur gravida nisi at nibh. In hac habitasse platea dictumst.,26/10/2021,28/03/2022,1259,4227,4370,4527,2014
3707,3707,"Cras pellentesque volutpat dui. Maecenas tristique, est et tempus semper, est quam pharetra magna, ac consequat metus sapien ut nunc.",10/06/2022,17/02/2022,1885,1664,1932,4708,4044
3708,3708,"Duis mattis egestas metus. Aenean fermentum. Donec ut mauris eget massa tempor convallis. Nulla neque libero, convallis eget, eleifend luctus, ultricies eu, nibh. Quisque id justo sit amet sapien dignissim vestibulum.",15/11/2021,13/08/2021,3765,1144,4550,2983,648
3709,3709,"In tempor, turpis nec euismod scelerisque, quam turpis adipiscing lorem, vitae mattis nibh ligula nec sem. Duis aliquam convallis nunc. Proin at turpis a pede posuere nonummy. Integer non velit.",24/02/2022,17/02/2022,2963,4931,3334,4192,3575
3710,3710,Maecenas tincidunt lacus at velit. Vivamus vel nulla eget eros elementum pellentesque. Quisque porta volutpat erat.,26/11/2021,24/03/2022,2210,541,1160,3561,2253
3711,3711,"Vestibulum ante ipsum primis in faucibus orci luctus et ultrices posuere cubilia Curae; Donec pharetra, magna vestibulum aliquet ultrices, erat tortor sollicitudin mi, sit amet lobortis sapien sapien non mi. Integer ac neque. Duis bibendum. Morbi non quam nec dui luctus rutrum. Nulla tellus.",19/08/2021,24/04/2022,3978,1047,1459,2900,3688
3712,3712,Proin interdum mauris non ligula pellentesque ultrices. Phasellus id sapien in sapien iaculis congue.,25/07/2021,31/03/2022,779,1949,440,1515,1260
3713,3713,"Duis at velit eu est congue elementum. In hac habitasse platea dictumst. Morbi vestibulum, velit id pretium iaculis, diam erat fermentum justo, nec condimentum neque sapien placerat ante. Nulla justo. Aliquam quis turpis eget elit sodales scelerisque.",06/08/2021,20/05/2022,251,584,1034,2061,1442
3714,3714,"Aliquam augue quam, sollicitudin vitae, consectetuer eget, rutrum at, lorem. Integer tincidunt ante vel ipsum. Praesent blandit lacinia erat. Vestibulum sed magna at nunc commodo placerat. Praesent blandit.",16/08/2021,25/10/2021,1361,4454,354,911,4236
3715,3715,"Nulla ac enim. In tempor, turpis nec euismod scelerisque, quam turpis adipiscing lorem, vitae mattis nibh ligula nec sem. Duis aliquam convallis nunc. Proin at turpis a pede posuere nonummy. Integer non velit.",15/09/2021,08/12/2021,2021,1293,4527,3257,2373
3716,3716,Morbi non quam nec dui luctus rutrum. Nulla tellus. In sagittis dui vel nisl.,20/09/2021,28/07/2021,3952,1222,2182,4075,4457
3717,3717,Nulla tellus. In sagittis dui vel nisl. Duis ac nibh.,14/05/2022,23/09/2021,1314,1906,117,4837,2381
3718,3718,"Cras mi pede, malesuada in, imperdiet et, commodo vulputate, justo.",23/10/2021,12/02/2022,2386,3612,2679,2095,4187
3719,3719,"Morbi odio odio, elementum eu, interdum eu, tincidunt in, leo. Maecenas pulvinar lobortis est.",13/07/2021,13/09/2021,3227,3176,3203,4722,4840
3720,3720,Praesent blandit lacinia erat.,31/12/2021,22/06/2021,764,4448,564,2294,1010
3721,3721,Cras non velit nec nisi vulputate nonummy. Maecenas tincidunt lacus at velit. Vivamus vel nulla eget eros elementum pellentesque. Quisque porta volutpat erat.,21/07/2021,13/08/2021,2439,2987,4222,886,3784
3722,3722,"Morbi sem mauris, laoreet ut, rhoncus aliquet, pulvinar sed, nisl. Nunc rhoncus dui vel sem. Sed sagittis.",03/01/2022,30/11/2021,3042,3026,788,1509,2640
3723,3723,"Fusce lacus purus, aliquet at, feugiat non, pretium quis, lectus. Suspendisse potenti. In eleifend quam a odio. In hac habitasse platea dictumst. Maecenas ut massa quis augue luctus tincidunt.",26/11/2021,26/02/2022,4450,3411,4181,144,326
3724,3724,Etiam vel augue. Vestibulum rutrum rutrum neque. Aenean auctor gravida sem. Praesent id massa id nisl venenatis lacinia.,24/03/2022,06/05/2022,1670,2809,2841,4586,1976
3725,3725,"Suspendisse ornare consequat lectus. In est risus, auctor sed, tristique in, tempus sit amet, sem. Fusce consequat.",29/03/2022,17/04/2022,195,1903,426,25,1883
3726,3726,Donec dapibus.,07/12/2021,29/06/2021,2019,1504,610,1787,2060
3727,3727,Donec ut mauris eget massa tempor convallis.,09/04/2022,29/04/2022,3819,4238,2765,653,4793
3728,3728,Mauris lacinia sapien quis libero.,11/11/2021,21/07/2021,1288,658,3686,3772,3019
3729,3729,"Proin risus. Praesent lectus. Vestibulum quam sapien, varius ut, blandit non, interdum in, ante.",04/01/2022,07/09/2021,1840,1256,2487,422,4183
3730,3730,"Nunc rhoncus dui vel sem. Sed sagittis. Nam congue, risus semper porta volutpat, quam pede lobortis ligula, sit amet eleifend pede libero quis orci.",31/10/2021,14/12/2021,4294,3062,2756,23,2668
3731,3731,Etiam vel augue. Vestibulum rutrum rutrum neque. Aenean auctor gravida sem.,19/05/2022,27/04/2022,2248,4696,1246,338,3965
3732,3732,Nulla suscipit ligula in lacus. Curabitur at ipsum ac tellus semper interdum.,28/09/2021,01/04/2022,1191,3189,3142,3684,4398
3733,3733,"Vivamus in felis eu sapien cursus vestibulum. Proin eu mi. Nulla ac enim. In tempor, turpis nec euismod scelerisque, quam turpis adipiscing lorem, vitae mattis nibh ligula nec sem. Duis aliquam convallis nunc.",07/09/2021,28/02/2022,909,2802,311,1591,3876
3734,3734,"Nam congue, risus semper porta volutpat, quam pede lobortis ligula, sit amet eleifend pede libero quis orci. Nullam molestie nibh in lectus.",13/05/2022,20/11/2021,2221,1098,949,3762,2172
3735,3735,Suspendisse potenti.,15/01/2022,06/10/2021,4751,873,3432,3631,4007
3736,3736,Nam nulla.,18/01/2022,12/11/2021,242,895,12,1823,1230
3737,3737,"In tempor, turpis nec euismod scelerisque, quam turpis adipiscing lorem, vitae mattis nibh ligula nec sem. Duis aliquam convallis nunc. Proin at turpis a pede posuere nonummy. Integer non velit. Donec diam neque, vestibulum eget, vulputate ut, ultrices vel, augue.",06/10/2021,27/07/2021,4961,3427,1821,4953,1323
3738,3738,Nullam molestie nibh in lectus. Pellentesque at nulla. Suspendisse potenti. Cras in purus eu magna vulputate luctus.,24/04/2022,30/05/2022,3086,1055,1973,4564,4872
3739,3739,Vivamus in felis eu sapien cursus vestibulum. Proin eu mi. Nulla ac enim.,04/03/2022,23/03/2022,2313,1476,1364,3089,1120
3740,3740,Pellentesque eget nunc.,16/09/2021,23/05/2022,1052,2452,3044,724,948
3741,3741,"Lorem ipsum dolor sit amet, consectetuer adipiscing elit.",22/09/2021,07/10/2021,794,1694,1501,4847,4013
3742,3742,Integer tincidunt ante vel ipsum. Praesent blandit lacinia erat. Vestibulum sed magna at nunc commodo placerat. Praesent blandit.,27/05/2022,15/07/2021,3019,4262,3903,4187,1624
3743,3743,"Aliquam sit amet diam in magna bibendum imperdiet. Nullam orci pede, venenatis non, sodales sed, tincidunt eu, felis. Fusce posuere felis sed lacus. Morbi sem mauris, laoreet ut, rhoncus aliquet, pulvinar sed, nisl.",26/06/2021,20/07/2021,4069,2207,2311,2469,934
3744,3744,"Vivamus metus arcu, adipiscing molestie, hendrerit at, vulputate vitae, nisl. Aenean lectus. Pellentesque eget nunc. Donec quis orci eget orci vehicula condimentum.",15/01/2022,06/04/2022,2257,2733,3428,3630,4721
3745,3745,"Nulla neque libero, convallis eget, eleifend luctus, ultricies eu, nibh. Quisque id justo sit amet sapien dignissim vestibulum. Vestibulum ante ipsum primis in faucibus orci luctus et ultrices posuere cubilia Curae; Nulla dapibus dolor vel est.",11/03/2022,30/01/2022,2032,2545,3399,4850,880
3746,3746,Nullam varius. Nulla facilisi. Cras non velit nec nisi vulputate nonummy.,11/06/2022,01/06/2022,1990,483,3725,4860,2938
3747,3747,"Fusce posuere felis sed lacus. Morbi sem mauris, laoreet ut, rhoncus aliquet, pulvinar sed, nisl.",13/09/2021,06/09/2021,2792,3730,4055,3236,4367
3748,3748,Vivamus tortor. Duis mattis egestas metus.,22/10/2021,02/07/2021,2913,4985,502,1654,1889
3749,3749,Pellentesque eget nunc. Donec quis orci eget orci vehicula condimentum.,25/02/2022,16/01/2022,179,4954,2747,3194,3198
3750,3750,"Maecenas tristique, est et tempus semper, est quam pharetra magna, ac consequat metus sapien ut nunc.",02/08/2021,27/08/2021,723,1631,312,1890,3125
3751,3751,Mauris lacinia sapien quis libero. Nullam sit amet turpis elementum ligula vehicula consequat. Morbi a ipsum.,26/02/2022,28/08/2021,2869,4235,1870,3362,617
3752,3752,Etiam vel augue.,18/09/2021,31/10/2021,3401,991,1273,4884,1683
3753,3753,"Donec odio justo, sollicitudin ut, suscipit a, feugiat et, eros. Vestibulum ac est lacinia nisi venenatis tristique. Fusce congue, diam id ornare imperdiet, sapien urna pretium nisl, ut volutpat sapien arcu sed augue. Aliquam erat volutpat.",01/09/2021,26/08/2021,817,2764,905,2562,4279
3754,3754,Suspendisse accumsan tortor quis turpis. Sed ante. Vivamus tortor.,18/11/2021,10/11/2021,4762,123,441,1413,1796
3755,3755,Integer ac neque.,24/07/2021,12/01/2022,1513,3834,2302,2881,3097
3756,3756,"Cras pellentesque volutpat dui. Maecenas tristique, est et tempus semper, est quam pharetra magna, ac consequat metus sapien ut nunc. Vestibulum ante ipsum primis in faucibus orci luctus et ultrices posuere cubilia Curae; Mauris viverra diam vitae quam.",27/09/2021,31/07/2021,4367,1137,4691,1498,528
3757,3757,"Morbi vestibulum, velit id pretium iaculis, diam erat fermentum justo, nec condimentum neque sapien placerat ante. Nulla justo.",04/09/2021,21/06/2021,2445,2119,109,3965,3896
3758,3758,Integer tincidunt ante vel ipsum. Praesent blandit lacinia erat. Vestibulum sed magna at nunc commodo placerat.,24/08/2021,10/03/2022,2096,1985,4575,883,2196
3759,3759,"Vestibulum ante ipsum primis in faucibus orci luctus et ultrices posuere cubilia Curae; Donec pharetra, magna vestibulum aliquet ultrices, erat tortor sollicitudin mi, sit amet lobortis sapien sapien non mi. Integer ac neque. Duis bibendum. Morbi non quam nec dui luctus rutrum. Nulla tellus.",23/12/2021,22/08/2021,4077,4595,2591,1096,382
3760,3760,"Donec odio justo, sollicitudin ut, suscipit a, feugiat et, eros. Vestibulum ac est lacinia nisi venenatis tristique. Fusce congue, diam id ornare imperdiet, sapien urna pretium nisl, ut volutpat sapien arcu sed augue. Aliquam erat volutpat. In congue.",16/04/2022,06/03/2022,2859,988,2986,4027,4865
3761,3761,"Fusce congue, diam id ornare imperdiet, sapien urna pretium nisl, ut volutpat sapien arcu sed augue.",17/12/2021,04/12/2021,4327,527,1267,2894,3326
3762,3762,"Vestibulum ante ipsum primis in faucibus orci luctus et ultrices posuere cubilia Curae; Donec pharetra, magna vestibulum aliquet ultrices, erat tortor sollicitudin mi, sit amet lobortis sapien sapien non mi.",26/11/2021,24/06/2021,1097,2751,1370,4437,2125
3763,3763,"In sagittis dui vel nisl. Duis ac nibh. Fusce lacus purus, aliquet at, feugiat non, pretium quis, lectus.",13/12/2021,08/06/2022,2082,3979,4434,2014,4029
3764,3764,Praesent id massa id nisl venenatis lacinia. Aenean sit amet justo. Morbi ut odio.,03/07/2021,28/09/2021,3469,1108,3579,2497,4915
3765,3765,"Fusce posuere felis sed lacus. Morbi sem mauris, laoreet ut, rhoncus aliquet, pulvinar sed, nisl. Nunc rhoncus dui vel sem. Sed sagittis. Nam congue, risus semper porta volutpat, quam pede lobortis ligula, sit amet eleifend pede libero quis orci.",18/04/2022,09/08/2021,4312,2658,2691,4016,479
3766,3766,Vestibulum ac est lacinia nisi venenatis tristique.,25/10/2021,25/05/2022,4971,3811,103,664,1670
3767,3767,Nulla suscipit ligula in lacus.,31/01/2022,08/03/2022,2481,3184,2575,2554,372
3768,3768,Vestibulum rutrum rutrum neque. Aenean auctor gravida sem. Praesent id massa id nisl venenatis lacinia. Aenean sit amet justo.,18/04/2022,07/11/2021,1530,2376,1481,921,1471
3769,3769,Nulla facilisi. Cras non velit nec nisi vulputate nonummy. Maecenas tincidunt lacus at velit. Vivamus vel nulla eget eros elementum pellentesque.,05/12/2021,28/02/2022,4969,4929,1231,1209,4477
3770,3770,"Donec posuere metus vitae ipsum. Aliquam non mauris. Morbi non lectus. Aliquam sit amet diam in magna bibendum imperdiet. Nullam orci pede, venenatis non, sodales sed, tincidunt eu, felis.",12/04/2022,29/05/2022,4106,3545,4249,1444,949
3771,3771,"Morbi sem mauris, laoreet ut, rhoncus aliquet, pulvinar sed, nisl. Nunc rhoncus dui vel sem. Sed sagittis. Nam congue, risus semper porta volutpat, quam pede lobortis ligula, sit amet eleifend pede libero quis orci. Nullam molestie nibh in lectus.",08/06/2022,12/10/2021,2756,2823,2136,2350,1540
3772,3772,"Vestibulum quam sapien, varius ut, blandit non, interdum in, ante. Vestibulum ante ipsum primis in faucibus orci luctus et ultrices posuere cubilia Curae; Duis faucibus accumsan odio. Curabitur convallis.",27/05/2022,27/08/2021,1323,1258,4028,1594,1580
3773,3773,Vestibulum ante ipsum primis in faucibus orci luctus et ultrices posuere cubilia Curae; Duis faucibus accumsan odio. Curabitur convallis. Duis consequat dui nec nisi volutpat eleifend. Donec ut dolor.,21/09/2021,25/05/2022,4379,279,2893,2367,3317
3774,3774,Cras in purus eu magna vulputate luctus.,08/05/2022,01/07/2021,995,3371,213,18,2312
3775,3775,In hac habitasse platea dictumst. Etiam faucibus cursus urna. Ut tellus. Nulla ut erat id mauris vulputate elementum. Nullam varius.,01/06/2022,09/02/2022,1777,934,4671,82,3810
3776,3776,"Quisque arcu libero, rutrum ac, lobortis vel, dapibus at, diam. Nam tristique tortor eu pede.",10/10/2021,08/07/2021,1119,67,194,4967,134
3777,3777,"Fusce posuere felis sed lacus. Morbi sem mauris, laoreet ut, rhoncus aliquet, pulvinar sed, nisl. Nunc rhoncus dui vel sem.",08/02/2022,28/07/2021,4383,3194,749,4135,2480
3778,3778,Nulla tellus. In sagittis dui vel nisl.,08/03/2022,18/02/2022,2307,3306,1324,4008,1557
3779,3779,Nulla mollis molestie lorem. Quisque ut erat. Curabitur gravida nisi at nibh. In hac habitasse platea dictumst.,23/09/2021,27/05/2022,3687,4579,1185,2505,3551
3780,3780,"Maecenas tristique, est et tempus semper, est quam pharetra magna, ac consequat metus sapien ut nunc. Vestibulum ante ipsum primis in faucibus orci luctus et ultrices posuere cubilia Curae; Mauris viverra diam vitae quam. Suspendisse potenti.",06/06/2022,17/07/2021,627,606,1594,491,4869
3781,3781,"In est risus, auctor sed, tristique in, tempus sit amet, sem. Fusce consequat. Nulla nisl. Nunc nisl. Duis bibendum, felis sed interdum venenatis, turpis enim blandit mi, in porttitor pede justo eu massa.",03/10/2021,30/06/2021,1044,460,582,2069,568
3782,3782,"Nam ultrices, libero non mattis pulvinar, nulla pede ullamcorper augue, a suscipit nulla elit ac nulla. Sed vel enim sit amet nunc viverra dapibus. Nulla suscipit ligula in lacus.",23/12/2021,23/06/2021,2508,3522,2953,1083,2413
3783,3783,In hac habitasse platea dictumst. Maecenas ut massa quis augue luctus tincidunt.,23/08/2021,06/09/2021,4678,4843,571,4665,3232
3784,3784,Nulla tellus. In sagittis dui vel nisl. Duis ac nibh.,25/01/2022,12/11/2021,1824,2112,4521,3725,4290
3785,3785,"Nam ultrices, libero non mattis pulvinar, nulla pede ullamcorper augue, a suscipit nulla elit ac nulla. Sed vel enim sit amet nunc viverra dapibus.",07/11/2021,06/06/2022,932,2864,463,1980,2345
3786,3786,"Integer pede justo, lacinia eget, tincidunt eget, tempus vel, pede. Morbi porttitor lorem id ligula. Suspendisse ornare consequat lectus.",12/08/2021,10/07/2021,4107,2176,754,2252,3282
3787,3787,Vivamus vel nulla eget eros elementum pellentesque. Quisque porta volutpat erat.,23/07/2021,21/11/2021,4427,4671,2326,895,1420
3788,3788,"Quisque porta volutpat erat. Quisque erat eros, viverra eget, congue eget, semper rutrum, nulla.",10/04/2022,08/05/2022,2409,2078,2266,416,4922
3789,3789,"Cras in purus eu magna vulputate luctus. Cum sociis natoque penatibus et magnis dis parturient montes, nascetur ridiculus mus.",20/11/2021,29/03/2022,3814,2379,4533,2955,434
3790,3790,Curabitur convallis. Duis consequat dui nec nisi volutpat eleifend. Donec ut dolor.,15/04/2022,13/08/2021,1699,235,1839,4928,3587
3791,3791,Nullam sit amet turpis elementum ligula vehicula consequat. Morbi a ipsum. Integer a nibh.,06/06/2022,07/10/2021,3038,4198,3514,1910,3931
3792,3792,"Morbi odio odio, elementum eu, interdum eu, tincidunt in, leo. Maecenas pulvinar lobortis est. Phasellus sit amet erat.",28/05/2022,07/01/2022,1497,354,2388,3233,4101
3793,3793,Sed vel enim sit amet nunc viverra dapibus. Nulla suscipit ligula in lacus.,19/05/2022,31/12/2021,1616,3478,3048,1995,1298
3794,3794,"Integer a nibh. In quis justo. Maecenas rhoncus aliquam lacus. Morbi quis tortor id nulla ultrices aliquet. Maecenas leo odio, condimentum id, luctus nec, molestie sed, justo.",05/02/2022,31/10/2021,1338,1396,2192,2359,4334
3795,3795,"Vivamus metus arcu, adipiscing molestie, hendrerit at, vulputate vitae, nisl. Aenean lectus.",26/10/2021,21/10/2021,2268,4342,4531,3336,852
3796,3796,"Nunc rhoncus dui vel sem. Sed sagittis. Nam congue, risus semper porta volutpat, quam pede lobortis ligula, sit amet eleifend pede libero quis orci. Nullam molestie nibh in lectus. Pellentesque at nulla.",19/06/2021,22/06/2021,4072,3244,4852,3647,1512
3797,3797,Suspendisse accumsan tortor quis turpis. Sed ante. Vivamus tortor.,14/01/2022,07/04/2022,2745,3740,4153,2905,1436
3798,3798,Sed ante. Vivamus tortor.,01/04/2022,25/06/2021,4709,929,3590,4623,3247
3799,3799,"In est risus, auctor sed, tristique in, tempus sit amet, sem. Fusce consequat. Nulla nisl. Nunc nisl.",28/04/2022,11/08/2021,4842,1692,960,4076,175
3800,3800,"Nam dui. Proin leo odio, porttitor id, consequat in, consequat ut, nulla. Sed accumsan felis. Ut at dolor quis odio consequat varius. Integer ac leo.",03/01/2022,02/01/2022,1842,1292,1843,1969,1186
3801,3801,"Integer aliquet, massa id lobortis convallis, tortor risus dapibus augue, vel accumsan tellus nisi eu orci. Mauris lacinia sapien quis libero. Nullam sit amet turpis elementum ligula vehicula consequat. Morbi a ipsum.",01/04/2022,30/09/2021,614,874,2202,2424,2262
3802,3802,"Mauris enim leo, rhoncus sed, vestibulum sit amet, cursus id, turpis. Integer aliquet, massa id lobortis convallis, tortor risus dapibus augue, vel accumsan tellus nisi eu orci.",10/07/2021,26/11/2021,195,2727,3827,1167,4176
3803,3803,"Nulla neque libero, convallis eget, eleifend luctus, ultricies eu, nibh. Quisque id justo sit amet sapien dignissim vestibulum. Vestibulum ante ipsum primis in faucibus orci luctus et ultrices posuere cubilia Curae; Nulla dapibus dolor vel est. Donec odio justo, sollicitudin ut, suscipit a, feugiat et, eros. Vestibulum ac est lacinia nisi venenatis tristique.",22/08/2021,30/03/2022,3763,3540,2632,1199,1157
3804,3804,Phasellus sit amet erat. Nulla tempus. Vivamus in felis eu sapien cursus vestibulum. Proin eu mi. Nulla ac enim.,02/04/2022,02/08/2021,2038,2730,1386,4508,4533
3805,3805,Nullam molestie nibh in lectus. Pellentesque at nulla. Suspendisse potenti. Cras in purus eu magna vulputate luctus.,26/01/2022,05/05/2022,203,3056,3859,4785,570
3806,3806,Nunc purus.,04/05/2022,27/03/2022,378,4216,3104,3321,1519
3807,3807,"Curabitur gravida nisi at nibh. In hac habitasse platea dictumst. Aliquam augue quam, sollicitudin vitae, consectetuer eget, rutrum at, lorem. Integer tincidunt ante vel ipsum.",05/08/2021,01/07/2021,1496,1678,3057,4484,1671
3808,3808,"Morbi quis tortor id nulla ultrices aliquet. Maecenas leo odio, condimentum id, luctus nec, molestie sed, justo. Pellentesque viverra pede ac diam.",28/07/2021,14/12/2021,749,1873,2536,2278,2754
3809,3809,Duis mattis egestas metus.,12/10/2021,22/05/2022,1368,2407,2647,4856,1294
3810,3810,Morbi non lectus. Aliquam sit amet diam in magna bibendum imperdiet.,09/05/2022,27/04/2022,2681,4061,159,1113,4096
3811,3811,Etiam pretium iaculis justo. In hac habitasse platea dictumst. Etiam faucibus cursus urna. Ut tellus. Nulla ut erat id mauris vulputate elementum.,26/05/2022,17/11/2021,4676,1427,4863,1103,4648
3812,3812,Etiam justo. Etiam pretium iaculis justo. In hac habitasse platea dictumst. Etiam faucibus cursus urna. Ut tellus.,26/11/2021,26/05/2022,603,857,1802,398,3849
3813,3813,Aliquam non mauris. Morbi non lectus.,15/12/2021,31/07/2021,4496,55,1343,188,127
3814,3814,"Vivamus vel nulla eget eros elementum pellentesque. Quisque porta volutpat erat. Quisque erat eros, viverra eget, congue eget, semper rutrum, nulla. Nunc purus.",26/08/2021,08/11/2021,2267,1029,2961,423,1388
3815,3815,Maecenas pulvinar lobortis est.,05/03/2022,15/07/2021,4000,2112,1362,2065,456
3816,3816,Fusce consequat.,29/08/2021,11/07/2021,1873,3483,4447,2457,2907
3817,3817,Aenean lectus.,20/01/2022,23/02/2022,3287,3704,4279,1268,2847
3818,3818,Sed accumsan felis. Ut at dolor quis odio consequat varius. Integer ac leo. Pellentesque ultrices mattis odio.,04/11/2021,28/07/2021,227,4956,366,3513,1031
3819,3819,"Proin risus. Praesent lectus. Vestibulum quam sapien, varius ut, blandit non, interdum in, ante. Vestibulum ante ipsum primis in faucibus orci luctus et ultrices posuere cubilia Curae; Duis faucibus accumsan odio.",25/02/2022,15/03/2022,3410,40,3997,1400,1906
3820,3820,Vestibulum ante ipsum primis in faucibus orci luctus et ultrices posuere cubilia Curae; Mauris viverra diam vitae quam.,08/05/2022,12/04/2022,1532,2266,424,520,4068
3821,3821,Morbi non quam nec dui luctus rutrum. Nulla tellus.,27/01/2022,09/11/2021,3433,3375,4245,2476,1406
3822,3822,"Suspendisse ornare consequat lectus. In est risus, auctor sed, tristique in, tempus sit amet, sem.",08/10/2021,26/06/2021,3004,4117,4556,2025,3838
3823,3823,"Morbi non lectus. Aliquam sit amet diam in magna bibendum imperdiet. Nullam orci pede, venenatis non, sodales sed, tincidunt eu, felis.",29/12/2021,07/06/2022,3021,1493,1935,2726,1973
3824,3824,Suspendisse accumsan tortor quis turpis. Sed ante. Vivamus tortor.,12/04/2022,14/10/2021,2699,4309,1229,3927,3501
3825,3825,"Integer ac leo. Pellentesque ultrices mattis odio. Donec vitae nisi. Nam ultrices, libero non mattis pulvinar, nulla pede ullamcorper augue, a suscipit nulla elit ac nulla. Sed vel enim sit amet nunc viverra dapibus.",01/12/2021,07/02/2022,2371,4686,4572,3515,4456
3826,3826,"In quis justo. Maecenas rhoncus aliquam lacus. Morbi quis tortor id nulla ultrices aliquet. Maecenas leo odio, condimentum id, luctus nec, molestie sed, justo.",02/03/2022,12/08/2021,4131,2210,4183,352,113
3827,3827,"Donec quis orci eget orci vehicula condimentum. Curabitur in libero ut massa volutpat convallis. Morbi odio odio, elementum eu, interdum eu, tincidunt in, leo.",17/12/2021,26/05/2022,2978,888,4733,438,4154
3828,3828,"Morbi vel lectus in quam fringilla rhoncus. Mauris enim leo, rhoncus sed, vestibulum sit amet, cursus id, turpis.",04/10/2021,11/11/2021,1863,354,2363,1500,3340
3829,3829,Phasellus in felis. Donec semper sapien a libero. Nam dui.,06/06/2022,12/11/2021,3105,3899,3778,682,3449
3830,3830,"Vestibulum quam sapien, varius ut, blandit non, interdum in, ante. Vestibulum ante ipsum primis in faucibus orci luctus et ultrices posuere cubilia Curae; Duis faucibus accumsan odio. Curabitur convallis. Duis consequat dui nec nisi volutpat eleifend. Donec ut dolor.",15/09/2021,22/08/2021,3431,2408,71,2650,3721
3831,3831,"Nunc nisl. Duis bibendum, felis sed interdum venenatis, turpis enim blandit mi, in porttitor pede justo eu massa. Donec dapibus. Duis at velit eu est congue elementum.",12/12/2021,19/04/2022,990,151,1685,3210,1437
3832,3832,"Duis mattis egestas metus. Aenean fermentum. Donec ut mauris eget massa tempor convallis. Nulla neque libero, convallis eget, eleifend luctus, ultricies eu, nibh. Quisque id justo sit amet sapien dignissim vestibulum.",20/05/2022,03/02/2022,27,4575,4648,4973,918
3833,3833,Aliquam quis turpis eget elit sodales scelerisque. Mauris sit amet eros.,21/05/2022,08/12/2021,636,4789,3098,1679,4804
3834,3834,"Nulla tellus. In sagittis dui vel nisl. Duis ac nibh. Fusce lacus purus, aliquet at, feugiat non, pretium quis, lectus. Suspendisse potenti.",26/08/2021,09/05/2022,2246,126,1018,4058,2863
3835,3835,"In est risus, auctor sed, tristique in, tempus sit amet, sem.",06/08/2021,06/07/2021,2076,2150,2588,3536,4770
3836,3836,Nulla mollis molestie lorem. Quisque ut erat. Curabitur gravida nisi at nibh.,14/12/2021,01/05/2022,2505,1626,4205,3520,319
3837,3837,"Nam congue, risus semper porta volutpat, quam pede lobortis ligula, sit amet eleifend pede libero quis orci. Nullam molestie nibh in lectus. Pellentesque at nulla. Suspendisse potenti. Cras in purus eu magna vulputate luctus.",08/10/2021,24/11/2021,2472,4281,2302,1057,3639
3838,3838,Mauris lacinia sapien quis libero. Nullam sit amet turpis elementum ligula vehicula consequat. Morbi a ipsum. Integer a nibh. In quis justo.,19/06/2021,18/10/2021,3473,4235,1108,3899,1436
3839,3839,Sed vel enim sit amet nunc viverra dapibus. Nulla suscipit ligula in lacus. Curabitur at ipsum ac tellus semper interdum.,15/12/2021,10/06/2022,3063,4231,1567,3707,1714
3840,3840,In hac habitasse platea dictumst. Etiam faucibus cursus urna. Ut tellus.,04/12/2021,18/04/2022,3148,3693,335,1763,3053
3841,3841,Vestibulum ante ipsum primis in faucibus orci luctus et ultrices posuere cubilia Curae; Mauris viverra diam vitae quam. Suspendisse potenti. Nullam porttitor lacus at turpis. Donec posuere metus vitae ipsum. Aliquam non mauris.,12/09/2021,23/04/2022,4299,3118,4063,873,4013
